{
  "schemaVersion": "1.1.0",
  "packId": "contra-stage1-strategy-v0",
  "gameProfileId": "contra",
  "romProfileId": "contra-j-good",
  "stageId": "stage-1",
  "status": "candidate",
  "updatedAt": "2026-06-11T22:59:47.833Z",
  "policy": {
    "appendOnlyRuns": true,
    "summaryDerivedFromRuns": true,
    "timeUnit": "seconds",
    "frameRate": 60,
    "promotionRequiresValidationReplay": true,
    "futurePackagesUseMeasuredLedgerOnly": true,
    "exactRomValidationRequired": true,
    "tasIsEvidenceNotController": true,
    "failureRunsMustBeRecorded": true
  },
  "stageSummary": {
    "stage-1": {
      "status": "candidate",
      "dataMode": "measured-ledger-only",
      "summary": {
        "trainingRuns": {
          "value": 43,
          "status": "candidate"
        },
        "knownDeaths": {
          "value": 39,
          "status": "candidate"
        },
        "unknownDeathRuns": {
          "value": 0,
          "status": "candidate"
        },
        "recordedRunTimeSeconds": {
          "value": 3481.7,
          "status": "candidate"
        },
        "clearProgress": {
          "value": "W3208 / W3300",
          "status": "candidate",
          "maxWorldX": 3208,
          "targetWorldX": 3300
        },
        "clearTimeSeconds": {
          "value": null,
          "status": "unverified"
        },
        "clearTimeFrames": {
          "value": null,
          "status": "unverified"
        },
        "kills": {
          "value": null,
          "status": "unverified"
        },
        "fixedTargetsDestroyed": {
          "value": null,
          "status": "unverified"
        },
        "rewardsCollected": {
          "value": null,
          "status": "unverified"
        },
        "maxProgress": {
          "value": 3208,
          "status": "candidate"
        }
      },
      "historicalEstimate": null
    }
  },
  "progressByStrategy": {
    "survival-v0": {
      "status": "candidate",
      "summary": {
        "trainingRuns": {
          "value": 30,
          "status": "candidate"
        },
        "deaths": {
          "value": 27,
          "status": "candidate"
        },
        "trainingTimeSeconds": {
          "value": 2324.36,
          "status": "candidate"
        },
        "clearProgress": {
          "value": "W3208 / W3300",
          "status": "candidate",
          "maxWorldX": 3208,
          "targetWorldX": 3300
        },
        "kills": {
          "value": null,
          "status": "unverified"
        },
        "fixedTargetsDestroyed": {
          "value": null,
          "status": "unverified"
        },
        "rewardsCollected": {
          "value": null,
          "status": "unverified"
        },
        "clearTimeFrames": {
          "value": null,
          "status": "unverified"
        },
        "clearTimeSeconds": {
          "value": null,
          "status": "unverified"
        },
        "maxProgress": {
          "value": 3208,
          "status": "candidate"
        }
      },
      "evidence": "Updated from headless-jsnes-runtime-smoke run jp-s1-w1753-weapon16-w2390-window-rejected-20260612; latest status candidate-failed."
    },
    "speedrun-v0": {
      "status": "candidate",
      "summary": {
        "trainingRuns": {
          "value": 1,
          "status": "candidate"
        },
        "deaths": {
          "value": 1,
          "status": "candidate"
        },
        "trainingTimeSeconds": {
          "value": 36.9,
          "status": "candidate"
        },
        "clearProgress": {
          "value": "W625 / W3300",
          "status": "candidate",
          "maxWorldX": 625,
          "targetWorldX": 3300
        },
        "kills": {
          "value": null,
          "status": "unverified"
        },
        "fixedTargetsDestroyed": {
          "value": null,
          "status": "unverified"
        },
        "rewardsCollected": {
          "value": null,
          "status": "unverified"
        },
        "clearTimeFrames": {
          "value": null,
          "status": "unverified"
        },
        "clearTimeSeconds": {
          "value": null,
          "status": "unverified"
        },
        "maxProgress": {
          "value": 625,
          "status": "candidate"
        }
      },
      "evidence": "Imported from contra-j-good trace evidence; best run matrix-speedrun-20260608 reached W625 with status candidate-failed."
    },
    "combat-v0": {
      "status": "candidate",
      "summary": {
        "trainingRuns": {
          "value": 10,
          "status": "candidate"
        },
        "deaths": {
          "value": 9,
          "status": "candidate"
        },
        "trainingTimeSeconds": {
          "value": 898.18,
          "status": "candidate"
        },
        "clearProgress": {
          "value": "W2174 / W3300",
          "status": "candidate",
          "maxWorldX": 2174,
          "targetWorldX": 3300
        },
        "kills": {
          "value": null,
          "status": "unverified"
        },
        "fixedTargetsDestroyed": {
          "value": null,
          "status": "unverified"
        },
        "rewardsCollected": {
          "value": null,
          "status": "unverified"
        },
        "clearTimeFrames": {
          "value": null,
          "status": "unverified"
        },
        "clearTimeSeconds": {
          "value": null,
          "status": "unverified"
        },
        "maxProgress": {
          "value": 2174,
          "status": "candidate"
        }
      },
      "evidence": "Imported from contra-j-good trace evidence; best run combat-boss-approach-early-pit-jump-check-20260608c reached W2174 with status candidate-failed."
    },
    "loot-v0": {
      "status": "candidate",
      "summary": {
        "trainingRuns": {
          "value": 1,
          "status": "candidate"
        },
        "deaths": {
          "value": 1,
          "status": "candidate"
        },
        "trainingTimeSeconds": {
          "value": 97.63,
          "status": "candidate"
        },
        "clearProgress": {
          "value": "W1943 / W3300",
          "status": "candidate",
          "maxWorldX": 1943,
          "targetWorldX": 3300
        },
        "kills": {
          "value": null,
          "status": "unverified"
        },
        "fixedTargetsDestroyed": {
          "value": null,
          "status": "unverified"
        },
        "rewardsCollected": {
          "value": null,
          "status": "unverified"
        },
        "clearTimeFrames": {
          "value": null,
          "status": "unverified"
        },
        "clearTimeSeconds": {
          "value": null,
          "status": "unverified"
        },
        "maxProgress": {
          "value": 1943,
          "status": "candidate"
        }
      },
      "evidence": "Imported from contra-j-good trace evidence; best run matrix-loot-20260608 reached W1943 with status candidate-failed."
    },
    "guard-v0": {
      "status": "candidate",
      "summary": {
        "trainingRuns": {
          "value": 1,
          "status": "candidate"
        },
        "deaths": {
          "value": 1,
          "status": "candidate"
        },
        "trainingTimeSeconds": {
          "value": 124.63,
          "status": "candidate"
        },
        "clearProgress": {
          "value": "W2038 / W3300",
          "status": "candidate",
          "maxWorldX": 2038,
          "targetWorldX": 3300
        },
        "kills": {
          "value": null,
          "status": "unverified"
        },
        "fixedTargetsDestroyed": {
          "value": null,
          "status": "unverified"
        },
        "rewardsCollected": {
          "value": null,
          "status": "unverified"
        },
        "clearTimeFrames": {
          "value": null,
          "status": "unverified"
        },
        "clearTimeSeconds": {
          "value": null,
          "status": "unverified"
        },
        "maxProgress": {
          "value": 2038,
          "status": "candidate"
        }
      },
      "evidence": "Imported from contra-j-good trace evidence; best run matrix-guard-20260608 reached W2038 with status candidate-failed."
    }
  },
  "runs": [
    {
      "runId": "combat-boss-approach-early-pit-jump-check-20260608c",
      "stageId": "stage-1",
      "strategyKey": "combat-v0",
      "side": "1P",
      "source": "browser-ai-botrun",
      "sourceRunId": "combat-boss-approach-early-pit-jump-check-20260608c",
      "evidencePath": "data/training/contra/runtime_runs/contra-j-good/trace-evidence/candidate-1p-combat-v0-boss-approach-early-pit-jump-death-worldx2174.json",
      "startedAt": "2026-06-08T19:12:00.000+08:00",
      "runCount": 1,
      "frames": 5585,
      "durationSeconds": 93.08,
      "activeFrame": null,
      "lostActiveFrame": 5585,
      "maxWorldX": 2174,
      "maxWorldFrame": 5585,
      "finalWorldX": 2174,
      "finalFrame": 5585,
      "targetWorldX": 3300,
      "deaths": 1,
      "status": "candidate-failed",
      "reason": "death-count",
      "rom": {
        "fileName": "Contra (J).nes",
        "md5": "0e40bc1b049c16c5d7246cc28399cb5d",
        "headerlessMd5": "d306c54ccfdf5cb4f8ec588f19b3e33d",
        "sha1": "376836361f404c815d404e1d5903d5d11f4eff0e",
        "sha256": "6ba53139fa88b8de1ae527c438bda6f1541d1ee7df26d63dec5164a32d166bfe"
      },
      "candidateTrial": "candidate-1p-combat-v0-boss-approach-early-pit-jump-death-worldx2174",
      "candidateConfig": null,
      "score": 4900,
      "weapon": 16,
      "lastInput": "down+right+B",
      "routeSegment": "boss-approach-clear",